File,Similarity,Refactoring,Added Features,Removed Features,Notes
CHANGES.rst,0%,unknown,False,False,Error in analysis: No JSON found in LLM output
tox.ini,100%,none,False,False,The two code files are identical in terms of structure and features. The only difference is that the order of some sections may be different.
LICENSE.txt,100%,none,False,False,Both files are identical in terms of structure and content. No changes or additions have been made.
.editorconfig,100%,none,False,False,The two code files are the same except for one line (the indentation setting for specific file types).
README.md,0%,unknown,False,False,Error in analysis: No JSON found in LLM output
.readthedocs.yaml,100%,none,False,False,The original and the forked versions of the code are identical. There are no changes in features or refactoring.
.pre-commit-config.yaml,100%,none,False,False,The two code files are identical in terms of structure and content. There is no evidence of any changes or refactorings.
CONTRIBUTING.rst,0%,unknown,False,False,Error in analysis: No JSON found in LLM output
pyproject.toml,100%,none,False,False,Both code files are identical in terms of structure and content. There are no added or removed features.
.gitignore,100%,none,False,False,Both files are identical with no additional or removed features. The only difference could be the order in which directories and files appear.
